<?xml version="1.0" encoding="UTF-8"?>
<scorecard xmlns="https://github.com/AnaMijailovic/XML-Tim19/scorecard"
 xmlns:xsi="http://www.w3.org/2001/XMLSchema-instance"
 xsi:schemaLocation="https://github.com/AnaMijailovic/XML-Tim19/scorecard file:/C:/Users/Dule/Desktop/WEB-MATERIJALI/XML-PROJEKAT/XML-Tim19/scientific_papers/scientific_papers/src/main/resources/xsd/scorecard.xsd">
    <originality score="1"/>
    <importance score="2"/>
    <clarity score="3"/>
    <relevance score="4"/>
    <value score="5"/>
    <purpose score="1"/>
    <courtesy score="2"/>
    <impact_factor score="3"/>
    <first_impressions score="4"/>
    <layout_and_format score="5"/>
    <design score="1"/>
    <methodology score="2"/>
    <scientific_approach score="3"/>
    <language score="4"/>
    <results score="5"/>
    <findings score="1"/>
    <research_implications score="2"/>
    <practical_implications score="3"/>
    <social_implications score="4"/>
    <research_limitations score="5"/>
    <further_discussion score="1"/>
    <justified_conclusions score="2"/>
    <acknowledgements score="3"/>
    <figures score="4"/>
    <tables score="5"/>
    <references score="1"/>
    <supplementary_data score="2"/>
</scorecard>
